{
  "vid": "v765",
  "name": {
    "zh-cn": "公主恋人",
    "ja-jp": "プリンセスラバー！",
    "ja-Latn": "princess-lover"
  },
  "level": 2,
  "updatedAt": "2026-04-13",
  "routes": [
    {
      "id": "route_game_guide",
      "name": "游戏攻略",
      "endings": [
        {
          "id": "ending_charlotte_end",
          "name": "夏洛特 END",
          "type": "normal",
          "steps": [
            {
              "id": "step_charlotte_01",
              "type": "choice",
              "content": "但是，两个人一起的话就没有问题了吧？",
              "group": "11月8日"
            },
            {
              "id": "step_charlotte_02",
              "type": "save",
              "content": "SAVE 1",
              "group": "11月8日"
            },
            {
              "id": "step_charlotte_03",
              "type": "choice",
              "content": "还是不要去碰跟社交部有关的话题为好",
              "group": "11月8日"
            },
            {
              "id": "step_charlotte_04",
              "type": "choice",
              "content": "有些累了……好想回家啊",
              "group": "11月16日"
            },
            {
              "id": "step_charlotte_05",
              "type": "choice",
              "content": "进入社交部有什么意义呢",
              "group": "11月24日"
            },
            {
              "id": "step_charlotte_06",
              "type": "save",
              "content": "SAVE 2",
              "group": "11月24日"
            },
            {
              "id": "step_charlotte_07",
              "type": "choice",
              "content": "跟夏洛特商量",
              "group": "11月24日"
            },
            {
              "id": "step_charlotte_08",
              "type": "choice",
              "content": "告诉她冬天里的乐趣",
              "group": "11月25日"
            },
            {
              "id": "step_charlotte_09",
              "type": "choice",
              "content": "夏洛特应该知道得很详细",
              "group": "11月28日"
            },
            {
              "id": "step_charlotte_10",
              "type": "choice",
              "content": "好好地照办吧",
              "group": "12月16日"
            }
          ]
        },
        {
          "id": "ending_sylvia_end",
          "name": "希尔维亚 END",
          "type": "normal",
          "steps": [
            {
              "id": "step_sylvia_01",
              "type": "load",
              "content": "LOAD 2"
            },
            {
              "id": "step_sylvia_02",
              "type": "choice",
              "content": "跟希尔维约会",
              "group": "11月24日"
            },
            {
              "id": "step_sylvia_03",
              "type": "choice",
              "content": "希尔维亚应该会有好点子吧",
              "group": "11月28日"
            },
            {
              "id": "step_sylvia_04",
              "type": "choice",
              "content": "在乎希尔维",
              "group": "12月14日"
            },
            {
              "id": "step_sylvia_05",
              "type": "choice",
              "content": "你父亲是不希望你这样的",
              "group": "12月15日"
            }
          ]
        },
        {
          "id": "ending_seika_end",
          "name": "圣华 END",
          "type": "normal",
          "steps": [
            {
              "id": "step_seika_01",
              "type": "load",
              "content": "LOAD 1"
            },
            {
              "id": "step_seika_02",
              "type": "choice",
              "content": "试着向先入部的前辈们询问社交部的活动",
              "group": "11月8日"
            },
            {
              "id": "step_seika_03",
              "type": "choice",
              "content": "不做些什么的话",
              "group": "11月16日"
            },
            {
              "id": "step_seika_04",
              "type": "choice",
              "content": "圣华同学会认可我吗",
              "group": "11月24日"
            },
            {
              "id": "step_seika_05",
              "type": "choice",
              "content": "遵守跟圣华同学的约定",
              "group": "11月24日"
            },
            {
              "id": "step_seika_06",
              "type": "choice",
              "content": "不过，她的皮肤好白好漂亮",
              "group": "11月25日"
            },
            {
              "id": "step_seika_07",
              "type": "save",
              "content": "SAVE 3",
              "group": "11月28日"
            },
            {
              "id": "step_seika_08",
              "type": "choice",
              "content": "向圣华同学详细地确认一下吧",
              "group": "11月28日"
            },
            {
              "id": "step_seika_09",
              "type": "choice",
              "content": "圣华也有圣华她自己的考虑嘛",
              "group": "12月14日"
            }
          ]
        },
        {
          "id": "ending_yuu_end",
          "name": "优 END",
          "type": "normal",
          "steps": [
            {
              "id": "step_yuu_01",
              "type": "load",
              "content": "LOAD 3"
            },
            {
              "id": "step_yuu_02",
              "type": "choice",
              "content": "回家后再考虑吧",
              "group": "11月28日"
            }
          ]
        }
      ]
    }
  ]
}
